{
  "kind": "watchcraft.collection-iterator-snapshot",
  "schema_version": 1,
  "project": {
    "project_id": "essence-of-linear-algebra",
    "revision": 1
  },
  "iterator": {
    "id": "watchcraft.youtube-playlist",
    "version": "1"
  },
  "observed_at": "2026-09-06T12:00:00Z",
  "source": {
    "source_id": "youtube-playlist:PLZHQObOWTQDPD3MizzM2xVFitgF8hE_ab",
    "source_type": "youtube-playlist",
    "title": "Essence of linear algebra",
    "canonical_url": "https://www.youtube.com/playlist?list=PLZHQObOWTQDPD3MizzM2xVFitgF8hE_ab",
    "metadata": {
      "publisher": "3Blue1Brown",
      "publisher_url": "https://www.youtube.com/@3blue1brown"
    }
  },
  "nodes": [
    {
      "node_id": "playlist-root",
      "node_type": "playlist",
      "title": "Essence of linear algebra",
      "canonical_url": "https://www.youtube.com/playlist?list=PLZHQObOWTQDPD3MizzM2xVFitgF8hE_ab",
      "parent_node_id": null,
      "position": 1,
      "metadata": {}
    }
  ],
  "items": [
    {
      "item_id": "youtube:fNk_zzaMoSs",
      "title": "Vectors | Chapter 1, Essence of linear algebra",
      "canonical_url": "https://www.youtube.com/watch?v=fNk_zzaMoSs",
      "media": [
        {
          "type": "youtube",
          "media_id": "fNk_zzaMoSs",
          "canonical_url": "https://www.youtube.com/watch?v=fNk_zzaMoSs"
        }
      ],
      "attribution": {
        "publisher": "3Blue1Brown",
        "publisher_url": "https://www.youtube.com/@3blue1brown",
        "license": null,
        "license_url": null
      },
      "source_provenance": {
        "playlist_id": "PLZHQObOWTQDPD3MizzM2xVFitgF8hE_ab"
      },
      "metadata": {
        "duration_seconds": 591,
        "published_at": "2016-08-05T17:05:49-07:00"
      }
    },
    {
      "item_id": "youtube:k7RM-ot2NWY",
      "title": "Linear combinations, span, and basis vectors | Chapter 2",
      "canonical_url": "https://www.youtube.com/watch?v=k7RM-ot2NWY",
      "media": [
        {
          "type": "youtube",
          "media_id": "k7RM-ot2NWY",
          "canonical_url": "https://www.youtube.com/watch?v=k7RM-ot2NWY"
        }
      ],
      "attribution": {
        "publisher": "3Blue1Brown",
        "publisher_url": "https://www.youtube.com/@3blue1brown",
        "license": null,
        "license_url": null
      },
      "source_provenance": {
        "playlist_id": "PLZHQObOWTQDPD3MizzM2xVFitgF8hE_ab"
      },
      "metadata": {
        "duration_seconds": 599,
        "published_at": "2016-08-06T16:49:28-07:00"
      }
    }
  ],
  "placements": [
    {
      "placement_id": "playlist-entry:1",
      "item_id": "youtube:fNk_zzaMoSs",
      "parent_node_id": "playlist-root",
      "position": 1,
      "source_url": "https://www.youtube.com/playlist?list=PLZHQObOWTQDPD3MizzM2xVFitgF8hE_ab",
      "metadata": {}
    },
    {
      "placement_id": "playlist-entry:2",
      "item_id": "youtube:k7RM-ot2NWY",
      "parent_node_id": "playlist-root",
      "position": 2,
      "source_url": "https://www.youtube.com/playlist?list=PLZHQObOWTQDPD3MizzM2xVFitgF8hE_ab",
      "metadata": {}
    }
  ],
  "coverage": {
    "basis": "source-entries",
    "expected": 2,
    "resolved": 2,
    "unresolved": []
  },
  "metadata_proposals": [
    {
      "field": "metadata.title",
      "value": "Essence of linear algebra",
      "basis": {
        "source_path": "source.title",
        "confidence": 1.0
      }
    }
  ],
  "structure_hash": "e2c3d80e4460d48d7f8808d694e7c9c7016853a9644b92065f1d80c61f2dbbc9",
  "provenance": {
    "access_profile": "public-anonymous",
    "discovery_mode": "legacy-import",
    "requested_url": "https://www.youtube.com/playlist?list=PLZHQObOWTQDPD3MizzM2xVFitgF8hE_ab",
    "retrieved_urls": [
      "https://www.youtube.com/playlist?list=PLZHQObOWTQDPD3MizzM2xVFitgF8hE_ab"
    ],
    "warnings": []
  }
}
